# UNIQUE constraint is only allowed on INT, UINT, and FLOAT
statement ok
CREATE TABLE test1 (
	a UINT UNIQUE NOT NULL
);

statement ok
CREATE TABLE test2 (
	a INT UNIQUE NOT NULL
);

statement ok
CREATE TABLE test3 (
	a FLOAT UNIQUE NOT NULL
);

statement error Unique field must be of type uint, int, or float
CREATE TABLE test4 (
	a TEXT UNIQUE NOT NULL
);

statement error Unique field must be of type uint, int, or float
CREATE TABLE test5 (
	a BOOL UNIQUE NOT NULL
);

statement ok
DROP TABLE test1, test2, test3;

# indeces are built by default on UNIQUE columns,
# only one UNIQUE column is allowed
statement ok
CREATE TABLE test (
	a INT UNIQUE NOT NULL,
	b FLOAT NOT NULL,
	c INT,
	d TEXT
);

statement ok
INSERT INTO test VALUES (1, 2.3, -4, 'a');

statement ok
INSERT INTO test VALUES (2, 3.4, 5, 'b');

statement ok
INSERT INTO test VALUES (3, 4.5, 6, 'c');

statement ok
INSERT INTO test VALUES (4, 5.6, 7, 'd');

statement ok
INSERT INTO test VALUES (5, 6.7, 8, 'e');

# Usually, the query optimizer decides when to
# use the index. In this case, we don't have an optimizer
# and therefore need to explicitly call the index with `PREWHERE`
query US
SELECT a, d FROM test PREWHERE (a >= 1);
----
1 a
2 b
3 c
4 d
5 e

query U
SELECT a FROM test PREWHERE (a < 3);
----
1
2

query U
SELECT a FROM test PREWHERE (a BETWEEN 1 AND 4);
----
1
2
3
4

query U
SELECT a FROM test PREWHERE (a = 5);
----
5

query U
SELECT a FROM test PREWHERE (a <= 4) WHERE a = 1 OR a = 2;
----
1
2

statement ok
DELETE FROM test WHERE a < 3;

query U
SELECT a FROM test PREWHERE (a < 3);
----

query U
SELECT a FROM test PREWHERE (a >= 3);
----
3
4
5

statement ok
DROP TABLE test;

statement ok
CREATE TABLE test (
	a FLOAT NOT NULL UNIQUE,
	b FLOAT NOT NULL
);

statement ok
INSERT INTO test VALUES (1.1, 2.2), (3.3, 4.4), (5.5, 6.6), (7.0, 8.0);

query FF
SELECT * FROM test;
----
1.1 2.2
3.3 4.4
5.5 6.6
7.0 8.0

query FF
SELECT a, b FROM test PREWHERE (a >= 1.1);
----
1.1 2.2
3.3 4.4
5.5 6.6
7.0 8.0

query FF
SELECT a, b FROM test PREWHERE (a BETWEEN 3.0 AND 5.1) WHERE b = 4.4;
----
3.3 4.4
