statement ok
CREATE TABLE test (a UINT UNIQUE NOT NULL, b FLOAT NOT NULL, c INT, d boolean);

statement ok
INSERT INTO test VALUES (1, 2.3, -4, true);

statement error Duplicate key 1 in column a
INSERT INTO test VALUES (1, 2.3, -4, true);

statement error NULL is not allowed in column b.
INSERT INTO test VALUES (2, null, -4, true);

statement ok
INSERT INTO test VALUES (2, 3.4, 5, false);

statement error NULL is not allowed in column b
UPDATE test SET b = null WHERE a = 1;

statement error Duplicate key 1 in column a
UPDATE test SET a = 1 WHERE a = 2;

statement ok
UPDATE test SET d = true WHERE a = 2;

query U
SELECT a FROM test;
----
1
2

statement ok
UPDATE test SET a = 3 WHERE a = 2;

query U
SELECT a FROM test;
----
1
3

statement ok
UPDATE test SET a = 4 WHERE a = 2;

query U
SELECT a FROM test;
----
1
3

query UFIB
SELECT a, b, c, d FROM test;
----
1 2.3 -4 true
3 3.4 5 true

statement ok
UPDATE test SET a = 5, b = 6.7, c = 8, d = false WHERE a = 1;

query UFIB
SELECT a, b, c, d FROM test;
----
3 3.4 5 true
5 6.7 8 false

